{
  "accepted_handoffs": [
    {
      "blockers": [],
      "changed_paths": [
        {"operation": "modified", "path": "src/tasktra/compiler.py", "summary": "Added versioned pack contracts, deterministic composition, generated pack plans, trust binding, and fail-closed projection paths."},
        {"operation": "added", "path": "src/tasktra/ecosystem.py", "summary": "Added pure bounded recommendation, capability preflight, migration preview, and monorepo planning."},
        {"operation": "modified", "path": "catalog/specialist-roles.toml", "summary": "Added structured contracts for the complete specialist catalog."},
        {"operation": "added", "path": "catalog/packs", "summary": "Added generic, ecosystem, and specialist-family pack manifests."}
      ],
      "downstream_brief": {
        "constraints": ["Preserve project ownership, local-first operation, and fail-closed pack trust."],
        "context": ["Stage 5 implementation and adversarial regressions are integrated."],
        "objective": "Independently test the specialist and ecosystem pack surface.",
        "recommended_next_steps": ["Run focused pack tests, the complete suite, compile drift, pack previews, and audit verification."]
      },
      "evidence_refs": [
        {"id": "stage-five-implementation", "kind": "file", "locator": "docs/stages/stage-5-completion.md", "summary": "The completion report inventories the delivered specialist, pack, trust, and planning boundaries."}
      ],
      "handoff_id": "stage-five-implementation",
      "human_summary": "Implemented generic software-development packs, specialist contracts, bounded planners, and checksum-bound trust.",
      "inferences": [],
      "kind": "tasktra.handoff",
      "producer": {"actor_id": "stage-five-implementer", "role": "implementer"},
      "requested_actions": [],
      "source": {"goal_id": "tasktra-1-0", "work_unit_id": "stage-5-specialist-ecosystem-packs"},
      "status": {"state": "completed", "summary": "Implementation is ready for independent testing."},
      "validation_results": [],
      "verified_facts": [
        {"evidence_ids": ["stage-five-implementation"], "statement": "The Stage 5 specialist and ecosystem implementation is present."}
      ],
      "version": 1
    },
    {
      "blockers": [],
      "changed_paths": [],
      "downstream_brief": {
        "constraints": ["Treat symbolic-link privilege skips as explicit environment limitations; require Windows junction regressions to pass."],
        "context": ["Focused pack/compiler tests, the complete repository suite, previews, drift, and audit checks pass."],
        "objective": "Perform independent semantic and security review of the passing implementation.",
        "recommended_next_steps": ["Probe ownership conflicts, external payloads, executable resolution, links, reparse points, and generated destinations."]
      },
      "evidence_refs": [
        {"id": "stage-five-tests", "kind": "command", "locator": "python -m unittest discover -s tests -q", "summary": "The final complete suite passed 254 tests with three environment-dependent symbolic-link skips."}
      ],
      "handoff_id": "stage-five-testing",
      "human_summary": "Verified the Stage 5 focused surface, complete suite, pack previews, clean projections, and audit chain.",
      "inferences": [],
      "kind": "tasktra.handoff",
      "producer": {"actor_id": "stage-five-tester", "role": "tester"},
      "requested_actions": [],
      "source": {"goal_id": "tasktra-1-0", "work_unit_id": "stage-5-specialist-ecosystem-packs"},
      "status": {"state": "completed", "summary": "All Stage 5 acceptance checks passed."},
      "validation_results": [
        {"detail": "254 tests passed; three symbolic-link tests skipped for unavailable Windows privilege; junction and reparse regressions passed.", "evidence_ids": ["stage-five-tests"], "name": "complete Stage 5 validation", "outcome": "passed"}
      ],
      "verified_facts": [
        {"evidence_ids": ["stage-five-tests"], "statement": "The final complete repository suite and Stage 5 acceptance surface passed."}
      ],
      "version": 1
    },
    {
      "blockers": [],
      "changed_paths": [],
      "downstream_brief": {
        "constraints": ["Do not execute migrations or collect telemetry until Stage 6 authority and acceptance gates are active."],
        "context": ["Independent adversarial review returned GO after every reproduced trust and path finding received a regression."],
        "objective": "Begin Stage 6 lifecycle and optimization from the reviewed pack contract.",
        "recommended_next_steps": ["Use docs/stages/stage-6.md as the active acceptance gate."]
      },
      "evidence_refs": [
        {"id": "stage-five-review", "kind": "note", "locator": "stage-5-final-independent-review", "summary": "Independent semantic and security review returned GO with no remaining source or behavioral blocker."}
      ],
      "handoff_id": "stage-five-review",
      "human_summary": "Independent review found no unresolved Stage 5 source, security, or behavioral blocker.",
      "inferences": [],
      "kind": "tasktra.handoff",
      "producer": {"actor_id": "stage-five-reviewer", "role": "reviewer"},
      "requested_actions": [],
      "source": {"goal_id": "tasktra-1-0", "work_unit_id": "stage-5-specialist-ecosystem-packs"},
      "status": {"state": "completed", "summary": "Stage 5 is eligible for closure."},
      "validation_results": [
        {"detail": "Reviewed checksum binding, external and directory payloads, Windows executable resolution, links/reparse points, projection containment, ownership collisions, deterministic planning, and drift state.", "evidence_ids": ["stage-five-review"], "name": "independent Stage 5 review", "outcome": "passed"}
      ],
      "verified_facts": [
        {"evidence_ids": ["stage-five-review"], "statement": "The final independent review returned GO with no unresolved blocker."}
      ],
      "version": 1
    }
  ],
  "current_role": null,
  "kind": "tasktra.implementation-workflow",
  "source": {"goal_id": "tasktra-1-0", "work_unit_id": "stage-5-specialist-ecosystem-packs"},
  "status": "completed",
  "transitions": [
    {"from_role": "implementer", "handoff_id": "stage-five-implementation", "handoff_status": "completed", "to_role": "tester"},
    {"from_role": "tester", "handoff_id": "stage-five-testing", "handoff_status": "completed", "to_role": "reviewer"},
    {"from_role": "reviewer", "handoff_id": "stage-five-review", "handoff_status": "completed", "to_role": null}
  ],
  "version": 1
}
