{
  "accepted_handoffs": [
    {
      "blockers": [],
      "changed_paths": [],
      "downstream_brief": {
        "constraints": ["Preserve the planned-only authority boundary."],
        "context": ["Stage 2 implementation and regressions are present in the repository."],
        "objective": "Independently validate the local workflow implementation.",
        "recommended_next_steps": ["Run the complete configured validation suite."]
      },
      "evidence_refs": [
        {
          "id": "implementation-review",
          "kind": "note",
          "locator": "stage-2 completion implementation",
          "summary": "The bounded Stage 2 implementation was integrated for independent testing."
        }
      ],
      "handoff_id": "stage-two-implementation",
      "human_summary": "Implemented the bounded Stage 2 local workflow surface and hardening regressions.",
      "inferences": [],
      "kind": "tasktra.handoff",
      "producer": {
        "actor_id": "stage-two-implementer",
        "role": "implementer"
      },
      "requested_actions": [],
      "source": {
        "goal_id": "tasktra-1-0",
        "work_unit_id": "stage-2-local-workflows"
      },
      "status": {
        "state": "completed",
        "summary": "Implementation is ready for independent testing."
      },
      "validation_results": [],
      "verified_facts": [
        {
          "evidence_ids": ["implementation-review"],
          "statement": "The Stage 2 implementation is present in the repository."
        }
      ],
      "version": 1
    },
    {
      "blockers": [],
      "changed_paths": [],
      "downstream_brief": {
        "constraints": ["Review semantic behavior in addition to test results."],
        "context": ["The full suite and projection check pass."],
        "objective": "Perform an independent semantic and security review.",
        "recommended_next_steps": ["Inspect the hardened boundaries and completion gates."]
      },
      "evidence_refs": [
        {
          "id": "stage-two-tests",
          "kind": "command",
          "locator": "python -m unittest discover -s tests -v",
          "summary": "The complete Stage 2 suite passed with only privilege-limited symlink skips."
        }
      ],
      "handoff_id": "stage-two-testing",
      "human_summary": "Verified the complete Stage 2 test suite and generated-output gate.",
      "inferences": [],
      "kind": "tasktra.handoff",
      "producer": {
        "actor_id": "stage-two-tester",
        "role": "tester"
      },
      "requested_actions": [],
      "source": {
        "goal_id": "tasktra-1-0",
        "work_unit_id": "stage-2-local-workflows"
      },
      "status": {
        "state": "completed",
        "summary": "All configured Stage 2 checks passed."
      },
      "validation_results": [
        {
          "detail": "104 tests passed, three symlink tests skipped for host privilege, and compile check was clean.",
          "evidence_ids": ["stage-two-tests"],
          "name": "complete Stage 2 validation",
          "outcome": "passed"
        }
      ],
      "verified_facts": [
        {
          "evidence_ids": ["stage-two-tests"],
          "statement": "The complete configured Stage 2 validation passed."
        }
      ],
      "version": 1
    },
    {
      "blockers": [],
      "changed_paths": [],
      "downstream_brief": {
        "constraints": ["Do not broaden Stage 2 authority while advancing the roadmap."],
        "context": ["Functional and semantic gates found no unresolved blocker."],
        "objective": "Begin the durable-autonomy stage from the recorded boundary.",
        "recommended_next_steps": ["Use the Stage 3 checklist as the active acceptance gate."]
      },
      "evidence_refs": [
        {
          "id": "independent-review",
          "kind": "note",
          "locator": "stage-2 independent semantic review",
          "summary": "Independent semantic and security review passed after remediation."
        }
      ],
      "handoff_id": "stage-two-review",
      "human_summary": "Independent review found no remaining Stage 2 correctness or security blocker.",
      "inferences": [],
      "kind": "tasktra.handoff",
      "producer": {
        "actor_id": "stage-two-reviewer",
        "role": "reviewer"
      },
      "requested_actions": [],
      "source": {
        "goal_id": "tasktra-1-0",
        "work_unit_id": "stage-2-local-workflows"
      },
      "status": {
        "state": "completed",
        "summary": "Stage 2 is eligible for closure."
      },
      "validation_results": [
        {
          "detail": "Reviewed completion evidence, identifiers, containment, routing, execution, and generated skills.",
          "evidence_ids": ["independent-review"],
          "name": "independent semantic review",
          "outcome": "passed"
        }
      ],
      "verified_facts": [
        {
          "evidence_ids": ["independent-review"],
          "statement": "The final independent review reported no unresolved blocker."
        }
      ],
      "version": 1
    }
  ],
  "current_role": null,
  "kind": "tasktra.implementation-workflow",
  "source": {
    "goal_id": "tasktra-1-0",
    "work_unit_id": "stage-2-local-workflows"
  },
  "status": "completed",
  "transitions": [
    {
      "from_role": "implementer",
      "handoff_id": "stage-two-implementation",
      "handoff_status": "completed",
      "to_role": "tester"
    },
    {
      "from_role": "tester",
      "handoff_id": "stage-two-testing",
      "handoff_status": "completed",
      "to_role": "reviewer"
    },
    {
      "from_role": "reviewer",
      "handoff_id": "stage-two-review",
      "handoff_status": "completed",
      "to_role": null
    }
  ],
  "version": 1
}
