{
  "accepted_handoffs": [
    {
      "blockers": [],
      "changed_paths": [
        {"operation": "added", "path": "src/tasktra/lifecycle.py", "summary": "Added pure adoption and upgrade planning bound to installed state and exact managed effects."},
        {"operation": "added", "path": "src/tasktra/upgrades.py", "summary": "Added authority-neutral exact-plan application, verification, snapshots, and recovery evidence."},
        {"operation": "added", "path": "src/tasktra/telemetry.py", "summary": "Added opt-in, local-only, closed-schema telemetry and explicit sanitized export."},
        {"operation": "added", "path": "src/tasktra/benchmarking.py", "summary": "Added deterministic comparison of measured efficiency and quality observations."},
        {"operation": "added", "path": "src/tasktra/lessons.py", "summary": "Added independently reviewed lesson proposals and deterministic promotion previews."}
      ],
      "downstream_brief": {
        "constraints": ["Preserve project authority, local-first defaults, privacy, and measured-only efficiency claims."],
        "context": ["Stage 6 lifecycle, telemetry, benchmark, and lesson surfaces are integrated."],
        "objective": "Test exact preview/apply/recovery behavior and all Stage 6 acceptance criteria.",
        "recommended_next_steps": ["Run focused, full-suite, drift, configured-validation, and audit checks."]
      },
      "evidence_refs": [
        {"id": "stage-six-implementation", "kind": "file", "locator": "docs/stages/stage-6-completion.md", "summary": "Completion report inventories lifecycle, privacy, efficiency, and lesson boundaries."}
      ],
      "handoff_id": "stage-six-implementation",
      "human_summary": "Implemented preview-first adoption and upgrades, bounded local telemetry, measured benchmarks, and reviewed lesson promotion.",
      "inferences": [],
      "kind": "tasktra.handoff",
      "producer": {"actor_id": "stage-six-implementer", "role": "implementer"},
      "requested_actions": [],
      "source": {"goal_id": "tasktra-1-0", "work_unit_id": "stage-6-lifecycle-optimization"},
      "status": {"state": "completed", "summary": "Implementation is ready for independent testing."},
      "validation_results": [],
      "verified_facts": [
        {"evidence_ids": ["stage-six-implementation"], "statement": "The Stage 6 implementation and acceptance fixtures are present."}
      ],
      "version": 1
    },
    {
      "blockers": [],
      "changed_paths": [],
      "downstream_brief": {
        "constraints": ["Keep environment-dependent symbolic-link skips visible and require Windows junction/reparse regressions to pass."],
        "context": ["Focused and complete tests, projection drift, configured validation, and audit checks pass."],
        "objective": "Adversarially review authority, ownership, migration, privacy, and recovery boundaries.",
        "recommended_next_steps": ["Probe external paths, undisclosed mutations, backup evidence, secret-shaped telemetry, and authority-ledger survival."]
      },
      "evidence_refs": [
        {"id": "stage-six-tests", "kind": "command", "locator": "python -m unittest discover -s tests -q", "summary": "The final repository suite passed 308 tests with six environment-dependent symbolic-link skips."}
      ],
      "handoff_id": "stage-six-testing",
      "human_summary": "Verified the Stage 6 focused surface, full repository suite, generated projections, configured validation, and audit chain.",
      "inferences": [],
      "kind": "tasktra.handoff",
      "producer": {"actor_id": "stage-six-tester", "role": "tester"},
      "requested_actions": [],
      "source": {"goal_id": "tasktra-1-0", "work_unit_id": "stage-6-lifecycle-optimization"},
      "status": {"state": "completed", "summary": "All automated Stage 6 acceptance checks passed."},
      "validation_results": [
        {"detail": "308 tests passed; six symbolic-link tests skipped for unavailable Windows privilege; junction and reparse regressions passed.", "evidence_ids": ["stage-six-tests"], "name": "complete Stage 6 validation", "outcome": "passed"}
      ],
      "verified_facts": [
        {"evidence_ids": ["stage-six-tests"], "statement": "The final complete repository suite and Stage 6 acceptance surface passed."}
      ],
      "version": 1
    },
    {
      "blockers": [],
      "changed_paths": [],
      "downstream_brief": {
        "constraints": ["Treat trusted executable migrations as reviewed full-host code, not a sandboxed capability."],
        "context": ["Independent security and acceptance reviews returned GO after every reproduced blocker received a regression."],
        "objective": "Begin Stage 7 operations and release work from the reviewed lifecycle contract.",
        "recommended_next_steps": ["Use docs/stages/stage-7.md as the active acceptance gate."]
      },
      "evidence_refs": [
        {"id": "stage-six-review", "kind": "note", "locator": "stage-6-final-independent-review", "summary": "Independent review returned GO with no unresolved Stage 6 blocker."}
      ],
      "handoff_id": "stage-six-review",
      "human_summary": "Independent review found no unresolved Stage 6 source, security, privacy, migration, rollback, or acceptance blocker.",
      "inferences": [],
      "kind": "tasktra.handoff",
      "producer": {"actor_id": "stage-six-reviewer", "role": "reviewer"},
      "requested_actions": [],
      "source": {"goal_id": "tasktra-1-0", "work_unit_id": "stage-6-lifecycle-optimization"},
      "status": {"state": "completed", "summary": "Stage 6 is eligible for closure."},
      "validation_results": [
        {"detail": "Reviewed exact preview/apply effects, project containment, runtime recovery, stale deletion, telemetry privacy, and lesson promotion.", "evidence_ids": ["stage-six-review"], "name": "independent Stage 6 review", "outcome": "passed"}
      ],
      "verified_facts": [
        {"evidence_ids": ["stage-six-review"], "statement": "The final independent review returned GO with no unresolved blocker."}
      ],
      "version": 1
    }
  ],
  "current_role": null,
  "kind": "tasktra.implementation-workflow",
  "source": {"goal_id": "tasktra-1-0", "work_unit_id": "stage-6-lifecycle-optimization"},
  "status": "completed",
  "transitions": [
    {"from_role": "implementer", "handoff_id": "stage-six-implementation", "handoff_status": "completed", "to_role": "tester"},
    {"from_role": "tester", "handoff_id": "stage-six-testing", "handoff_status": "completed", "to_role": "reviewer"},
    {"from_role": "reviewer", "handoff_id": "stage-six-review", "handoff_status": "completed", "to_role": null}
  ],
  "version": 1
}
